title,points,vintage,type,variety,region_2,region_1,province,country,winery,price,abv,description,taste,acidity,sweetness,tannin,body,cost-effectiveness,image,vivino_url
Bodegas Juan Gil (Yellow Label) Monastrell,4.1,2023,Red wine,Monastrell,Jumilla,Murcia,Murcia,Spain,Bodegas Juan Gil,"₩30,000 ",15.00%,"This wine is made from 100% Monastrell grapes from old vines in the Jumilla region of Spain. Aged for 4 months in French oak, it is known for its deep color and powerful aromas. It offers an intense bouquet of ripe blackberry, blueberry, and plum, with toasted notes of coffee, cocoa, and spice from the oak. The palate is rich, full-bodied, and well-structured with a long, savory finish.","oak, vanilla, chocolate, smoke, blackberry, plum, dark fruit, blueberry, cherry, pepper",3,1,4,4,5,https://images.vivino.com/thumbs/V8PyRnKuROmcpxJBUuzmDQ_pb_x600.png,https://www.vivino.com/fr/juan-gil-jumilla-yellow-label/w/1134571?ref=nav-search
Marchesi Antinori Tenuta Tignanello Chianti Classico Riserva,4.3,2020,Red wine,Sangiovese,Chianti Classico,Toscana,Toscana,Italy,Marchesi Antinori,"₩85,000 ",14.00%,"Produced by the historic Antinori family at their Tignanello estate, this Chianti Classico Riserva is predominantly Sangiovese. Aged in oak barrels, it's a wine of great elegance and complexity, showing intense aromas of red fruits like cherry and raspberry, along with notes of licorice, vanilla, and spice. The palate is full-bodied and supple with velvety tannins and a long, savory finish.","oak, vanilla, tobacco, leather, cherry, raspberry, plum, earthy, strawberry",5,1,4,4,2,https://images.vivino.com/thumbs/SeGbLh20S5W7N0WcIqBywQ_pb_x600.png,https://www.vivino.com/fr/antinori-tuscany-tenuta-tignanello-marchese-antinori-chianti-classico-riserva/w/1654?ref=nav-search
Feudo Arancio Dalila Riserva,4,2021,White wine,"Blend (Grillo, Viognier)",Sicilia DOC,Sicily,Sicily,Italy,Feudo Arancio,"₩35,000 ",13.50%,"Dalila is an intriguing white blend from Sicily, combining the native Grillo grape with aromatic Viognier. A portion of the wine is fermented in oak barrels, adding complexity. It presents a bouquet of ripe tropical fruits, peach, and apricot, with hints of vanilla and wildflowers. The palate is rich and full-bodied yet balanced by a refreshing acidity, leading to a persistent and aromatic finish.","oak, vanilla, butter, tropical, pineapple, mango, peach, apricot, citrus",3,1,1,3,5,https://images.vivino.com/thumbs/RWiGDh50RyqHBmoa-FuKaQ_pb_x600.png,https://www.vivino.com/fr/feudo-arancio-dalila-riserva/w/1191231?ref=nav-search
Viña Vistamar Reserva Merlot,3.6,2019,Red wine,Merlot,Maule Valley,Central Valley,Maule Valley,Chile,Viña Vistamar,"₩20,000 ",13.50%,"This Merlot Reserva from Chile's Maule Valley is known for being soft, fruity, and approachable. It is aged for a short period in oak to add subtle complexity. The wine displays aromas of ripe red fruits like plums and cherries, mixed with notes of black pepper, chocolate, and a hint of vanilla. On the palate, it is medium-bodied with soft, rounded tannins and a pleasant, fruity finish.","oak, vanilla, chocolate, plum, cherry, blackberry, raspberry, pepper",2,1,3,3,4,https://images.vivino.com/thumbs/srr2vi-mRxSHzNAxdwxBkA_pb_x600.png,https://www.vivino.com/fr/vina-palo-alto-reserva-ii-merlot-shiraz-tempranillo-viognier/w/1231378?ref=nav-search
Redtree Chardonnay,3.5,2019,White wine,Chardonnay,California,California,California,United States,Redtree Wines,"₩18,000 ",13.50%,"Redtree Chardonnay is a fruit-forward, crowd-pleasing wine from California. It aims for a clean and refreshing style, opening with aromas of green apple, pear, and citrus, with a touch of tropical fruit and vanilla. The palate is bright and crisp, with a medium body and a smooth finish, making it a versatile wine for pairing with a variety of dishes or enjoying on its own.","apple, pear, citrus, tropical, pineapple, vanilla, butter",3,1,1,2,4,https://images.vivino.com/thumbs/gNtszOX3SPaVb3FByyyzQA_pb_x600.png,https://www.vivino.com/fr/redtree-chardonnay/w/13490?ref=nav-search
Château Tour d'Auron,3.6,2020,Red wine,"Blend (Merlot, Cabernet Sauvignon)",Bordeaux,Bordeaux,Bordeaux,France,Château Tour d'Auron,"₩20,000 ",13.50%,"Château Tour d'Auron is a classic Bordeaux red from the Entre-Deux-Mers region. It typically presents a blend of Merlot and Cabernet Sauvignon, offering straightforward and approachable fruit flavors. Expect aromas of red fruits like cherry and plum with some earthy and spicy undertones. On the palate, it is medium-bodied with smooth tannins, making it an easy-drinking wine suitable for everyday meals.","cherry, plum, earthy, blackberry, cassis, oak, tobacco",3,1,3,3,4,https://images.vivino.com/thumbs/iY6G7FIlSa6MXfKhDoue6Q_pb_x600.png,https://www.vivino.com/fr/tour-d-auron-bordeaux-superieur/w/1193573?ref=nav-search
Château Valandraud 'Symphony No. 3 Eroica',4.5,2012,Red wine,"Blend (Sauvignon Blanc, Sémillon, Sauvignon Gris)",Saint-Émilion Grand Cru,Bordeaux,Bordeaux,France,Château Valandraud,"₩350,000 ",14.50%,"A special bottling from one of Saint-Émilion's most famous ""garage wine"" producers. The 2012 vintage is characterized by its opulence and concentration, revealing complex aromas of black cherries, truffle, licorice, and smoke, with hints of chocolate and espresso. The palate is full-bodied, dense, and layered, with ripe, velvety tannins and a remarkably long finish. This edition celebrated Beethoven's 250th anniversary.","oak, vanilla, chocolate, tobacco, leather, truffle, blackberry, cherry, plum, cassis",3,1,5,5,1,https://cfnimage.commutil.kr/phpwas/restmb_allidxmake.php?pp=002&idx=3&simg=202005071013290307699ebb0383812323473.jpg&nmt=18,https://www.vivino.com/fr/chateau-valandraud-symphony-eroica-no-3-saint-emilion-grand-cru/w/8707174?ref=nav-search
Domaine Octavie Touraine Sauvignon Blanc,3.8,2021,White wine,Sauvignon Blanc,Touraine,Loire Valley,Loire,France,Domaine Octavie,"₩30,000 ",12.50%,"This is a classic Sauvignon Blanc from the Touraine appellation in France's Loire Valley. The wine bursts with vibrant notes of gooseberry, grapefruit, and fresh-cut grass, with a distinct flinty mineral character. On the palate, it is light-bodied, crisp, and dry, with a zesty acidity and a clean, refreshing finish, making it a quintessential example of the grape from its homeland.","grapefruit, gooseberry, citrus, green apple, grassy, mineral, flint",5,1,1,2,5,https://images.vivino.com/thumbs/NTqSOMKlRsmmM31tyoD8rQ_pb_x600.png,https://www.vivino.com/fr/roc-de-chateauvieux-sauvignon-blanc-touraine/w/1144601?ref=nav-search
Casa Marin Cipreses Vineyard Sauvignon Blanc,4.3,2022,White wine,Sauvignon Blanc,San Antonio Valley,Aconcagua,Aconcagua,Chile,Casa Marin,"₩50,000 ",13.50%,"From the cool-climate, coastal San Antonio Valley in Chile, this is one of the country's benchmark white wines. It is intensely aromatic, showcasing pungent notes of green bell pepper and citrus zest, combined with a saline, stony minerality. The palate is bone-dry and electric, with a sharp, piercing acidity and a long, savory finish. (Note: Vintage not fully visible, 2022 used as a recent example).","grapefruit, gooseberry, citrus, lime, bell pepper, grassy, mineral, saline",5,1,1,3,4,https://images.vivino.com/thumbs/HlLvJFBIS_OjAHD0KnqV1A_pb_x600.png,https://www.vivino.com/fr/casa-marin-cipreses-vineyard-sauvignon-blanc/w/1147982?ref=nav-search
Louis Jadot Bourgogne,3.8,2019,Red wine,Pinot Noir,Bourgogne,Burgundy,Burgundy,France,Louis Jadot,"₩45,000 ",13.00%,"A benchmark for the category, this Pinot Noir is sourced from various vineyards across Burgundy. It is aged in French oak barrels, which adds a subtle spice note. The wine exhibits classic Burgundy aromas of fresh red fruits like cherry and raspberry, with earthy undertones and a hint of spice. It's medium-bodied with silky tannins and a fresh, elegant finish, representing great value and typicity.","cherry, raspberry, earthy, cranberry, strawberry, oak, spice",4,1,2,2,3,https://images.vivino.com/thumbs/YtGIp7cLSRSUpucZV4RMuw_pb_x600.png,https://www.vivino.com/fr/louis-jadot-bourgogne-pinot-noir/w/1135000?ref=nav-search
Louis Latour Bourgogne,3.7,2020,Red wine,Pinot Noir,Bourgogne,Burgundy,Burgundy,France,Louis Latour,"₩40,000 ",13.00%,"From another iconic Burgundy producer, this wine is known for its consistent quality. It is fermented in stainless steel and aged in oak barrels. The wine displays a bouquet of bright red fruits, such as cherry and redcurrant, complemented by earthy notes and a touch of black pepper. The palate is light to medium-bodied with supple tannins and a crisp, refreshing finish.","cherry, raspberry, redcurrant, earthy, pepper, spice",4,1,2,2,3,https://images.vivino.com/thumbs/OlQRfPzBR0qG0VlCym74FA_pb_x600.png,https://www.vivino.com/fr/louis-latour-bourgogne-pinot-noir/w/7343?ref=nav-search
Ménage à Trois Bourbon Barrel Aged,4,2021,Red wine,Cabernet Sauvignon,California,California,California,United States,Ménage à Trois,"₩30,000 ",14.50%,"This Californian Cabernet Sauvignon is aged for three months in Bourbon barrels, which imparts unique and bold flavors. The result is a wine with intense aromas of ripe blackberry, dark cherry, and vanilla, layered with notes of caramel, toasted oak, and a hint of smokiness from the bourbon barrels. It is full-bodied and rich on the palate with a smooth, lingering finish.","oak, vanilla, chocolate, caramel, smoke, blackberry, dark fruit, cherry",2,1,4,5,5,https://images.vivino.com/thumbs/23gQFho2SbO267Ze_I9e5g_pb_x600.png,https://www.vivino.com/fr/menage-a-trois-bourbon-barrel-cabernet-sauvignon/w/7300825?ref=nav-search
Thörle Saulheim Spätburgunder Kalkstein,4.1,2022,Red wine,Spätburgunder (Pinot Noir),Rheinhessen,Rheinhessen,Rheinhessen,Germany,Thörle,"₩60,000 ",13.00%,"Spätburgunder is the German name for Pinot Noir, and this example comes from the limestone (Kalkstein) soils of Rheinhessen. This terroir imparts a distinct minerality to the wine. It offers elegant aromas of sour cherry, raspberry, and wild strawberry, with subtle notes of spice and earth. The palate is light-bodied and precise, with a fine tannic structure, vibrant acidity, and a long, mineral-driven finish.","cherry, raspberry, strawberry, earthy, mineral, spice, cranberry",5,1,2,3,4,https://images.vivino.com/thumbs/90qyj-kwTUi7qLyIMJqJtg_pb_x600.png,https://www.vivino.com/fr/thorle-saulheimer-spatburgunder-kalkstein/w/1140901?ref=nav-search
"Ménage à Trois 
Bourbon Barrel Cabernet Sauvignon",4,2022,Red wine,Cabernet Sauvignon,,,California,United States,Ménage à Trois,"₩35,000 ",14.50%,"This Californian Cabernet Sauvignon is aged for at least three months in Bourbon barrels, a technique that imparts unique and bold flavors. The wine is full-bodied and rich, bursting with aromas of ripe blackberry, dark cherry, and plum. These fruit notes are layered with distinct hints of caramel, vanilla, and toasted, smoky oak derived from the bourbon barrel aging, leading to a smooth and robust finish.","oak, vanilla, caramel, blackberry, blueberry, smoke, leather, cherrry, pepper, brown sugar, cream",2,1,4,5,5,https://images.vivino.com/thumbs/23gQFho2SbO267Ze_I9e5g_pb_x960.png,https://www.vivino.com/en/menage-a-trois-bourbon-barrel-cabernet-sauvignon/w/7300825?year=2022
"Félix Solís 
The Guv’nor",4.1,N.V.,Red wine,Tempranillo,,Valdepeñas,Castilla,Spain,Félix Solís,"₩15,000 ",13.50%,"Enjoy this fruity red, revel in the smooth oaky vanilla and be satisfied by the rich aromas.","vanilla, oak, chocolate, blackberry, plum, blackcurrant, dark fruit, cherry, red fruit, strawberry, leather, pepper, cheese, citrus",2,1,2,4,5,https://images.vivino.com/thumbs/YtEIDYyoRJ2x9-iT8wS6OQ_pb_x960.png,https://www.vivino.com/en/felix-solis-the-guv-nor-valdepenas/w/5445838
"Casa Rojo 
Las Viñas Bastardas",4,2021,Red wine,"Blend(Shiraz/Syrah, Monastrell, Garnacha)",,,Murcia,Spain,Casa Rojo,"₩35,000 ",14.00%,"From the innovative Spanish producer Casa Rojo, this is a creative and modern red blend. Crafted from Syrah, Monastrell, and Grenache grown in southeastern Spain, the wine is powerful and expressive. It offers intense aromas of ripe black fruits like blackberry and plum, with notes of raspberry, black pepper, and licorice. The palate is full-bodied and well-structured with ripe tannins and a long, spicy finish.","bluberry, blackberry, oak, vanilla, strawberry, leather, pepper",4,1,4,4,4,https://images.vivino.com/thumbs/OpcsjGHRS_mhw7nY7ghxJg_pb_x960.png,https://www.vivino.com/en/casa-rojo-las-vinas-bastardas/w/7803840?year=2021
"Yellow Tail 
Shiraz",3.5,2024,Red wine,Shiraz/Syrah,,,South Eastern Australia,Australia,Yellow Tail,"₩17,000 ",13.50%,Shiraz is created with a simple philosophy in mind - to make a great wine that everyone can enjoy anytime in any place. Enjoy this wine with a bunch of friends and a hearty BBQ steak.,"vanilla, oak, chocolate, plum, blackberry, dark fruit, jam, blackcurrant, cherry, red fruit, raspberry, strawberry, pepper, licorice, smoke, leather, cheese",2,1,2,3,4,https://images.vivino.com/thumbs/WwLXNj2TSJKEgcbtmVDyZw_pb_x960.png,https://www.vivino.com/en/yellow-tail-shiraz/w/2547?year=2024
"Grant Burge Wines 
Barossa Ink Shiraz",3.9,2023,Red wine,Shiraz/Syrah,Barossa Valley,Barossa,South Australia,Australia,Grant Burge Wines,"₩19,000 ",14.50%,"Deep purple, with a blue / purple hue. Rich aromas of plums, raspberries, dark chocolate and blueberry jam with underlying mint and cinnamon. The dense, rich, full bodied wine has a sensual palate offering plenty of texture, fine velvet tannins and soft, round dark fruit flavours, complimented by dark chocolate ice.","plum, blackberry, dark fruit, blackcurrant, chocolate, vanilla, oak, cherry, raspberry, pepper, leather",2,1,4,5,5,https://images.vivino.com/thumbs/gAFVPJ5DS4uQ1MoHnvZm3Q_pb_x960.png,https://www.vivino.com/en/grant-burge-wines-barossa-ink-shiraz/w/5310954?year=2023